{
 "format": "ghosh/3",
 "id": "swagat-pranam",
 "generated": {
  "by": "compile3",
  "at": "2026-10-20T05:53:29.784Z"
 },
 "meta": {
  "title": {
   "dev": "स्वागतप्रणाम",
   "rom": "Swagat Pranam"
  },
  "kind": "rachana",
  "section": "naimittik",
  "verse": [],
  "usage": [],
  "performance": {
   "mode": "standing"
  },
  "notes": [
   "Rupak: 7 matras per गण, गट of 3+2+2.",
   "The closing ॥ स ऽ – ॥ / ॥ त–– ॥ is a 3-matra tag after the last गण.",
   "The Anak starts one matra early (pickup त) so both parts meet on the first सम."
  ]
 },
 "rhythm": {
  "talas": {
   "rupak": {
    "name": {
     "dev": "रूपक",
     "rom": "Rupak"
    },
    "cycle": 7,
    "ganSize": 7,
    "gats": [
     3,
     2,
     2
    ],
    "count": "१ २ ३ , ४ ५ , ६ ७",
    "roll": {
     "strokesPerMatra": 3,
     "pattern": "tankar+2 anutankar",
     "confidence": "assumed"
    },
    "steps": null,
    "talVadya": {
     "default": "gat",
     "variants": {
      "gat": {
       "beats": [
        1,
        4,
        6
       ],
       "label": "every गट",
       "confidence": "book"
      }
     },
     "use": "gat"
    },
    "explain": {
     "mr": "रूपक ७ मात्रांचा ताल आहे: एका गणात ३ + २ + २ मात्रांचे तीन गट, आणि एक गण म्हणजेच एक आवर्तन.",
     "hi": "रूपक ७ मात्राओं का ताल है: एक गण में ३ + २ + २ मात्राओं के तीन गट, और एक गण ही एक आवर्तन है।",
     "en": "Rupak has 7 matras: one गण of 3 + 2 + 2, which is the whole cycle."
    }
   }
  },
  "tala": "rupak",
  "laya": 120,
  "charans": [
   {
    "id": "c1",
    "n": 1,
    "repeat": 1,
    "tala": "rupak",
    "laya": 120,
    "segments": [
     "b"
    ]
   },
   {
    "id": "c2",
    "n": 2,
    "repeat": 1,
    "tala": "rupak",
    "laya": 120,
    "segments": [
     "b"
    ],
    "role": "closing-tag"
   }
  ],
  "form": [
   "c1",
   "c2"
  ],
  "countIn": {
   "count": 2,
   "words": [
    "एक",
    "दो"
   ],
   "matras": 2,
   "on": "panav",
   "note": "ध्वंकार-द्वय"
  }
 },
 "parts": {
  "shankh": {
   "instrument": "shankh",
   "role": "melody",
   "kind": "printed",
   "gans": [
    {
     "addr": "c1.b.0",
     "charan": "c1",
     "seg": "b",
     "line": 1,
     "gats": [
      {
       "matras": [
        {
         "slots": [
          {
           "type": "note",
           "dev": "स",
           "swara": "S",
           "octave": 0
          }
         ],
         "beat": 1
        },
        {
         "slots": [
          {
           "type": "hold",
           "dev": "ऽ"
          }
         ],
         "beat": 2
        },
        {
         "slots": [
          {
           "type": "note",
           "dev": "प",
           "swara": "P",
           "octave": -1
          }
         ],
         "beat": 3
        }
       ]
      },
      {
       "matras": [
        {
         "group": true,
         "slots": [
          {
           "type": "note",
           "dev": "स",
           "swara": "S",
           "octave": 0
          },
          {
           "type": "note",
           "dev": "ग",
           "swara": "G",
           "octave": 0
          }
         ],
         "beat": 4
        },
        {
         "group": true,
         "slots": [
          {
           "type": "note",
           "dev": "प",
           "swara": "P",
           "octave": -1
          },
          {
           "type": "note",
           "dev": "स",
           "swara": "S",
           "octave": 0
          }
         ],
         "beat": 5
        }
       ]
      },
      {
       "matras": [
        {
         "group": true,
         "slots": [
          {
           "type": "note",
           "dev": "ग",
           "swara": "G",
           "octave": 0
          },
          {
           "type": "note",
           "dev": "प",
           "swara": "P",
           "octave": 0
          }
         ],
         "beat": 6
        },
        {
         "group": true,
         "slots": [
          {
           "type": "note",
           "dev": "स",
           "swara": "S",
           "octave": 0
          },
          {
           "type": "note",
           "dev": "ग",
           "swara": "G",
           "octave": 0
          }
         ],
         "beat": 7
        }
       ]
      }
     ]
    },
    {
     "addr": "c1.b.1",
     "charan": "c1",
     "seg": "b",
     "line": 2,
     "gats": [
      {
       "matras": [
        {
         "slots": [
          {
           "type": "note",
           "dev": "प",
           "swara": "P",
           "octave": 0
          }
         ],
         "beat": 1
        },
        {
         "slots": [
          {
           "type": "hold",
           "dev": "ऽ"
          }
         ],
         "beat": 2
        },
        {
         "slots": [
          {
           "type": "rest",
           "dev": "–"
          }
         ],
         "beat": 3
        }
       ]
      },
      {
       "matras": [
        {
         "slots": [
          {
           "type": "note",
           "dev": "प",
           "swara": "P",
           "octave": 0
          }
         ],
         "beat": 4
        },
        {
         "group": true,
         "slots": [
          {
           "type": "note",
           "dev": "ग",
           "swara": "G",
           "octave": 0
          },
          {
           "type": "note",
           "dev": "स",
           "swara": "S",
           "octave": 0
          }
         ],
         "beat": 5
        }
       ]
      },
      {
       "matras": [
        {
         "slots": [
          {
           "type": "note",
           "dev": "प",
           "swara": "P",
           "octave": -1
          }
         ],
         "beat": 6
        },
        {
         "group": true,
         "slots": [
          {
           "type": "note",
           "dev": "स",
           "swara": "S",
           "octave": 0
          },
          {
           "type": "note",
           "dev": "ग",
           "swara": "G",
           "octave": 0
          }
         ],
         "beat": 7
        }
       ]
      }
     ]
    },
    {
     "addr": "c1.b.2",
     "charan": "c1",
     "seg": "b",
     "line": 3,
     "gats": [
      {
       "matras": [
        {
         "slots": [
          {
           "type": "note",
           "dev": "स",
           "swara": "S",
           "octave": 0
          }
         ],
         "beat": 1
        },
        {
         "slots": [
          {
           "type": "hold",
           "dev": "ऽ"
          }
         ],
         "beat": 2
        },
        {
         "slots": [
          {
           "type": "note",
           "dev": "प",
           "swara": "P",
           "octave": -1
          }
         ],
         "beat": 3
        }
       ]
      },
      {
       "matras": [
        {
         "group": true,
         "slots": [
          {
           "type": "note",
           "dev": "स",
           "swara": "S",
           "octave": 0
          },
          {
           "type": "note",
           "dev": "ग",
           "swara": "G",
           "octave": 0
          }
         ],
         "beat": 4
        },
        {
         "group": true,
         "slots": [
          {
           "type": "note",
           "dev": "प",
           "swara": "P",
           "octave": -1
          },
          {
           "type": "note",
           "dev": "स",
           "swara": "S",
           "octave": 0
          }
         ],
         "beat": 5
        }
       ]
      },
      {
       "matras": [
        {
         "group": true,
         "slots": [
          {
           "type": "note",
           "dev": "ग",
           "swara": "G",
           "octave": 0
          },
          {
           "type": "note",
           "dev": "प",
           "swara": "P",
           "octave": 0
          }
         ],
         "beat": 6
        },
        {
         "group": true,
         "slots": [
          {
           "type": "note",
           "dev": "स",
           "swara": "S",
           "octave": 0
          },
          {
           "type": "note",
           "dev": "ग",
           "swara": "G",
           "octave": 0
          }
         ],
         "beat": 7
        }
       ]
      }
     ]
    },
    {
     "addr": "c1.b.3",
     "charan": "c1",
     "seg": "b",
     "line": 4,
     "gats": [
      {
       "matras": [
        {
         "slots": [
          {
           "type": "note",
           "dev": "प",
           "swara": "P",
           "octave": 0
          }
         ],
         "beat": 1
        },
        {
         "slots": [
          {
           "type": "hold",
           "dev": "ऽ"
          }
         ],
         "beat": 2
        },
        {
         "slots": [
          {
           "type": "rest",
           "dev": "–"
          }
         ],
         "beat": 3
        }
       ]
      },
      {
       "matras": [
        {
         "slots": [
          {
           "type": "note",
           "dev": "प",
           "swara": "P",
           "octave": 0
          }
         ],
         "beat": 4
        },
        {
         "group": true,
         "slots": [
          {
           "type": "note",
           "dev": "प",
           "swara": "P",
           "octave": 0
          },
          {
           "type": "note",
           "dev": "प",
           "swara": "P",
           "octave": 0
          }
         ],
         "beat": 5
        }
       ]
      },
      {
       "matras": [
        {
         "slots": [
          {
           "type": "note",
           "dev": "ग",
           "swara": "G",
           "octave": 0
          }
         ],
         "beat": 6
        },
        {
         "group": true,
         "slots": [
          {
           "type": "note",
           "dev": "ग",
           "swara": "G",
           "octave": 0
          },
          {
           "type": "note",
           "dev": "ग",
           "swara": "G",
           "octave": 0
          }
         ],
         "beat": 7
        }
       ]
      }
     ]
    },
    {
     "addr": "c1.b.4",
     "charan": "c1",